<?xml version="1.0" encoding="UTF-8"?>
<!--Sample XML file generated by XMLSpy v2010 rel. 3 (http://www.altova.com)-->
<DMucDMuc xsi:schemaLocation="http://kekhaithue.gdt.gov.vn/DanhMucVan DMucDMuc.xsd" xmlns="http://kekhaithue.gdt.gov.vn/DanhMucVan" xmlns:xsi="http://www.w3.org/2001/XMLSchema-instance">
	<DMuc orientation="0" maDanhMuc="01" pBanDanhMuc="2.0.0" viewMethod="1">
		<XMLSchema>XMLSchemamaDanhMuc</XMLSchema>
		<XSLT>XSLTmaDanhMuc</XSLT>
		<ExcelTemplate>String</ExcelTemplate>
		<DSachPLuc>
			<PLuc plucID="String" plucOrientation="0" plucViewMethod="1">
				<TenPLuc>String</TenPLuc>
				<PLucXSLT>String</PLucXSLT>
				<PLucExcelTemplate>String</PLucExcelTemplate>
			</PLuc>
		</DSachPLuc>
	</DMuc>
</DMucDMuc>
